{"type":"config","name":"CI test reliability","metricName":"ci_failure_score","metricUnit":"","bestDirection":"lower"}
{"run":1,"commit":"73a219c","metric":0,"metrics":{},"status":"keep","description":"Baseline: added autoresearch harness using two CI-like unit-suite reruns in autoresearch.sh and docs/typecheck/test:stable gating in autoresearch.checks.sh. Current baseline is green with ci_failure_score=0.","timestamp":1774620153757,"segment":0,"confidence":null,"iterationTokens":200}
{"type":"config","name":"PR #61 JSON-RPC resume replay flake","metricName":"resume_replay_failures","metricUnit":"","bestDirection":"lower"}
{"run":2,"commit":"8006143","metric":0,"metrics":{},"status":"keep","description":"Retargeted autoresearch to the real PR #61 CI failure: repeated CI-like reruns of the JSON-RPC thread/resume replay timeout. Baseline reproduced 0 failures across 6 focused reruns, and docs/typecheck/full CI-style unit suite/test:stable all passed.","timestamp":1774620724918,"segment":1,"confidence":null,"iterationTokens":3341}
{"type":"config","name":"PR #61 server.jsonrpc.flow flake reproduction","metricName":"jsonrpc_flow_failures","metricUnit":"","bestDirection":"lower"}
{"run":3,"commit":"4018a02","metric":0,"metrics":{},"status":"keep","description":"Widened the reproducer from the single PR-failing test to the entire test/server.jsonrpc.flow.test.ts file under CI=true. Baseline stayed green across 8 reruns, with full docs/typecheck/CI-style suite/test:stable checks still passing.","timestamp":1774621068681,"segment":2,"confidence":null,"iterationTokens":109}
{"type":"config","name":"PR #61 merge-ref CI reproduction","metricName":"merge_ci_failures","metricUnit":"","bestDirection":"lower"}
{"run":4,"commit":"4018a02","metric":0,"metrics":{},"status":"checks_failed","description":"Switched the benchmark to the actual PR #61 merge ref in a worktree and ran the real CI unit suite twice under CI=true. Both benchmark runs passed, but the correctness gate later reproduced the exact flake: server JSON-RPC flows > thread/resume replays a journal cursor once before reattaching the live thread sink timed out after 45s on the merge ref.","timestamp":1774621441914,"segment":3,"confidence":null,"iterationTokens":200}
{"type":"config","name":"PR #61 merge-ref CI reproduction x4","metricName":"merge_ci_failures","metricUnit":"","bestDirection":"lower"}
{"run":5,"commit":"c58250f","metric":0,"metrics":{},"status":"keep","description":"Strengthened merge-ref reproduction to 4 repeated CI=true full-suite runs in the actual PR #61 merge worktree. All 4 benchmark runs passed and the merge-ref docs/typecheck/CI-suite/test:stable checks also passed, so the flake is real but rarer than the earlier failed check suggested.","timestamp":1774621687303,"segment":4,"confidence":null,"iterationTokens":185}
{"type":"config","name":"PR #61 merge-ref CI reproduction x10","metricName":"merge_ci_failures","metricUnit":"","bestDirection":"lower"}
{"type":"config","name":"PR #61 merge-ref thread/resume stress","metricName":"merge_resume_failures","metricUnit":"","bestDirection":"lower"}
{"run":6,"commit":"1f6de2a","metric":17,"metrics":{},"status":"keep","description":"Established a sensitive reproducer for the real flake by hammering the exact PR #61 merge-ref thread/resume JSON-RPC test 200 times under CI=true. Baseline reproduced 17 failures, confirming the race lives in the targeted test path itself rather than needing the full suite.","timestamp":1774623280726,"segment":6,"confidence":null,"iterationTokens":182}
{"type":"config","name":"Current repo thread/resume stress","metricName":"resume_failures","metricUnit":"","bestDirection":"lower"}
{"run":7,"commit":"90ca5ea","metric":1,"metrics":{},"status":"keep","description":"Pivoted the flake benchmark onto the current repo so candidate fixes can be measured directly. Baseline reproduced 1 timeout in 100 CI-like reruns of the exact thread/resume JSON-RPC test.","timestamp":1774623649055,"segment":7,"confidence":null,"iterationTokens":155}
{"run":8,"commit":"90ca5ea","metric":1,"metrics":{},"status":"discard","description":"Tried hardening the reconnect tests by waiting for the original websocket to fully close before reconnecting. The 100-run stress metric stayed flat at 1 failure, so close-handshake timing alone does not explain the flake.","timestamp":1774624018398,"segment":7,"confidence":null,"iterationTokens":14584}
{"run":9,"commit":"90ca5ea","metric":3,"metrics":{},"status":"discard","description":"Added per-step failure diagnostics to the flaky thread/resume test, but the stress metric worsened to 3/100 from added overhead and Bun's test-timeout path still did not flush the custom diagnostics. This path is not giving actionable signal.","timestamp":1774624562995,"segment":7,"confidence":null,"iterationTokens":3744}
{"run":10,"commit":"29a6452","metric":0,"metrics":{},"status":"keep","description":"Forced active connection shutdown in the flaky test cleanup (`await server.stop(true)`) so Bun does not hang on lingering websocket state. This improved the 100-run thread/resume stress metric from 1 failure to 0, and docs/typecheck/full CI-style suite/test:stable all passed.","timestamp":1774624881430,"segment":7,"confidence":null,"iterationTokens":19911}
{"run":11,"commit":"29a6452","metric":0,"metrics":{},"status":"discard","description":"Confirmation rerun on the kept `server.stop(true)` cleanup change stayed at 0 failures across another 100 stress iterations with checks still green. No additional improvement versus the kept result, but this increases confidence the fix is real.","timestamp":1774625198601,"segment":7,"confidence":null,"iterationTokens":1261}
{"type":"config","name":"Main CI reliability guardrails","metricName":"ci_guardrail_failures","metricUnit":"","bestDirection":"lower"}
{"run":12,"commit":"b7f41f6","metric":0,"metrics":{},"status":"keep","description":"Hardened the main CI workflow with explicit typecheck and stable per-file unit test steps, and added test/ci.workflow.test.ts to lock those guardrails in. The workflow benchmark is now green and full docs/typecheck/CI-style suite/test:stable checks all passed.","timestamp":1774625644054,"segment":8,"confidence":null,"iterationTokens":104}
{"type":"config","name":"JSON-RPC teardown guardrails","metricName":"unsafe_jsonrpc_teardowns","metricUnit":"","bestDirection":"lower"}
{"run":13,"commit":"653c4e3","metric":0,"metrics":{},"status":"keep","description":"Codified forced-close teardown guardrails for the websocket-heavy JSON-RPC flow spec by adding stopTestServer() in test/helpers/wsHarness.ts and replacing plain await server.stop() callsites. The unsafe teardown count dropped from 20 to 0, and docs/typecheck/full CI-style suite/test:stable all passed.","timestamp":1774626922975,"segment":9,"confidence":null,"iterationTokens":106}
{"type":"config","name":"Toolstream teardown guardrails","metricName":"unsafe_toolstream_teardowns","metricUnit":"","bestDirection":"lower"}
{"run":14,"commit":"45c392f","metric":2,"metrics":{},"status":"keep","description":"Retargeted the benchmark to the remaining websocket-heavy sibling file, test/server.toolstream.test.ts. Baseline found 2 plain await server.stop() teardown callsites still using the known-risk pattern.","timestamp":1774627042798,"segment":10,"confidence":null,"iterationTokens":105}
{"run":15,"commit":"a8c4b97","metric":0,"metrics":{},"status":"keep","description":"Applied the shared forced-close helper to test/server.toolstream.test.ts, replacing its 2 remaining plain await server.stop() teardown callsites. The unsafe toolstream teardown count dropped from 2 to 0, and docs/typecheck/full CI-style suite/test:stable all passed.","timestamp":1774627208395,"segment":10,"confidence":null,"iterationTokens":2320}
{"type":"config","name":"Remaining server/websocket teardown guardrails","metricName":"unsafe_server_teardowns","metricUnit":"","bestDirection":"lower"}
{"run":16,"commit":"33e4158","metric":48,"metrics":{},"status":"keep","description":"Retargeted the benchmark to the remaining server/websocket specs still using plain stop teardowns. Baseline found 48 plain server.stop() callsites across desktop.controlSocket.threadList, harness.ws.e2e, server.jsonrpc.control, server.jsonrpc, and server.test.","timestamp":1774627328985,"segment":11,"confidence":null,"iterationTokens":106}
{"run":17,"commit":"325aac8","metric":0,"metrics":{},"status":"keep","description":"Applied stopTestServer() across the remaining server/websocket specs: desktop.controlSocket.threadList, harness.ws.e2e, server.jsonrpc.control, server.jsonrpc, and server.test. The unsafe server teardown count dropped from 48 to 0, and docs/typecheck/full CI-style suite/test:stable all passed.","timestamp":1774627558150,"segment":11,"confidence":null,"iterationTokens":10334}
{"type":"config","name":"All server teardown guardrails","metricName":"unsafe_all_server_teardowns","metricUnit":"","bestDirection":"lower"}
{"run":18,"commit":"3f59ee8","metric":2,"metrics":{},"status":"keep","description":"Broadened the benchmark to all remaining plain server.stop() callsites across test/**/*.test.ts. Baseline found 2 leftovers in the live/persisted handoff test inside test/server.jsonrpc.flow.test.ts.","timestamp":1774627910804,"segment":12,"confidence":null,"iterationTokens":105}
{"run":19,"commit":"d371156","metric":0,"metrics":{},"status":"keep","description":"Removed the final 2 plain server.stop() callsites in test/server.jsonrpc.flow.test.ts by routing the live/persisted handoff teardown through stopTestServer(). The all-tests unsafe teardown count dropped from 2 to 0, and docs/typecheck/full CI-style suite/test:stable all passed.","timestamp":1774628064050,"segment":12,"confidence":null,"iterationTokens":653}
{"type":"config","name":"Repeated full CI-style suite reliability","metricName":"full_ci_failures","metricUnit":"","bestDirection":"lower"}
{"run":20,"commit":"d23caf6","metric":0,"metrics":{},"status":"keep","description":"Retargeted to the real overall signal: 5 repeated CI=true full-suite runs after the teardown and workflow hardening. All 5 benchmark runs passed, and docs/typecheck/CI-style suite/test:stable checks also passed.","timestamp":1774628413694,"segment":13,"confidence":null,"iterationTokens":135}
{"type":"config","name":"Repeated stable-runner reliability","metricName":"stable_failures","metricUnit":"","bestDirection":"lower"}
{"run":21,"commit":"23e33d5","metric":0,"metrics":{},"status":"keep","description":"Retargeted to the stricter per-file stable runner signal. Three repeated `bun run test:stable -- --max-concurrency 1` passes succeeded, and docs/typecheck/full CI-style suite/test:stable checks also passed.","timestamp":1774628886101,"segment":14,"confidence":null,"iterationTokens":132}
{"run":22,"commit":"23e33d5","metric":0,"metrics":{},"status":"discard","description":"Confirmation rerun on the repeated stable-runner workload stayed clean at 0 failures across another 3 isolated per-file passes, increasing confidence that the current test suite state is genuinely stable rather than a one-off green run.","timestamp":1774629346214,"segment":14,"confidence":null,"iterationTokens":1429}
{"type":"config","name":"CI green-run noise reduction","metricName":"ci_noise_lines","metricUnit":"","bestDirection":"lower"}
{"run":23,"commit":"f3bfbe4","metric":41,"metrics":{},"status":"keep","description":"Retargeted from flake detection to CI signal quality. Baseline on one full CI-style suite pass shows 41 noisy green-run lines: 29 repeated Google GenAI experimental warnings, 11 repeated Langfuse degraded-config warnings, and 1 expected desktop init error line.","timestamp":1774629824138,"segment":15,"confidence":null,"iterationTokens":132}
{"run":24,"commit":"545cc39","metric":32,"metrics":{},"status":"keep","description":"Reduced green-run CI noise with low-risk test-only changes: disabled observability in the shared websocket test helper and silenced the expected desktop init error log in bootstrap-cache.test.ts. Noise dropped from 41 to 32 lines, removing the expected error line and cutting Langfuse warnings from 11 to 3.","timestamp":1774630065970,"segment":15,"confidence":null,"iterationTokens":4227}
{"run":25,"commit":"9befb5c","metric":4,"metrics":{},"status":"keep","description":"Cached the Google Interactions client per API key in src/runtime/googleNativeInteractions.ts and added a focused runtime test proving the SDK experimental warning only fires once per key. Full-suite green-run noise dropped from 32 to 4 lines, with Google warnings reduced from 29 to 1 and checks still all green.","timestamp":1774630311165,"segment":15,"confidence":4.111111111111111,"iterationTokens":4064}
